{"archived_tests":["tests/verify-adversarial-review-gate.ps1","tests/verify-aiteamcode-skill-contract.ps1","tests/verify-entry-routing-clarification.ps1","tests/verify-lite-artifact-validator.ps1","tests/verify-repair-shared-memory.ps1","tests/verify-runtime-state-contract.ps1","tests/verify-shared-memory-layers.ps1","tests/verify-skill-manifest.ps1","tests/verify-stage-discipline-matrix.ps1","tests/verify-team-orchestration.ps1","tests/verify-tool-profile.ps1","tests/verify-v1-v2-coexistence.ps1","tests/verify-workflow-contracts.ps1","tests/verify-workflow-descriptor.ps1"],"capability_source_catalog_digest":"sha256:18767a87dbb08d6a80e6c7eecfc493a27ab4ab1822b7e90982e7539493c669f6","core_groups":{"entry-lifecycle":["tests/verify-v1-sunset.ps1","tests/verify-v2-entry-contract.ps1","tests/verify-v2-protocol-config.ps1","tests/verify-runtime-qualification-decoupling.ps1","tests/verify-v2-direct-no-artifacts.ps1","tests/verify-v2-requirement-gate.ps1","tests/verify-v2-json-compat.ps1","tests/verify-v2-task-state.ps1","tests/verify-v2-model-neutrality.ps1","tests/verify-v1-to-v2-migration.ps1","tests/verify-v2-default-flip.ps1","tests/verify-v2-runtime-memory-decoupling.ps1"],"evaluation-release":["tests/run-scenario-evals.ps1","tests/verify-model-eval-runner.ps1","tests/verify-rollout-evidence.ps1","tests/verify-exact-head-engineering-evidence.ps1","tests/verify-v1-stop-loss-qualification.ps1","tests/verify-host-benchmark-runner.ps1","tests/verify-host-benchmark-otel.ps1","tests/verify-host-benchmark-qualification.ps1","tests/verify-release-runner-boundary.ps1","tests/verify-release-isolation-qualification.ps1","tests/verify-release-full-receipt.ps1","tests/verify-release-producer-receipts.ps1","tests/verify-ordinary-ci-receipt.ps1","tests/verify-v2-ci-routing.ps1"],"governance-approval":["tests/verify-v2-governed-audit.ps1","tests/verify-v2-approval.ps1","tests/verify-v2-readonly-zero-write.ps1"],"harness-contracts":["tests/verify-thin-adapters.ps1","tests/verify-canonical-json.ps1","tests/verify-harness-entry.ps1","tests/verify-hashing-module.ps1","tests/verify-kernel-tcb-inventory.ps1","tests/verify-lite-footprint.ps1","tests/verify-minimal-safe-change-policy.ps1","tests/verify-no-node-install-dependency.ps1","tests/verify-placeholder-rendering.ps1","tests/verify-release-validation.ps1","tests/verify-task-artifact-drift-audit.ps1","tests/verify-thin-trust-kernel-contracts.ps1","tests/verify-module-manifest-catalog.ps1"],"install-evidence":["tests/verify-declarative-distribution.ps1","tests/verify-v2-install-presets.ps1","tests/verify-preset-lifecycle-qualification.ps1","tests/verify-v2-evidence.ps1"]},"full_tests":["tests/verify-adapter-transport.ps1","tests/verify-archive-memory-candidates.ps1","tests/verify-ask-codex.ps1","tests/verify-canonical-json.ps1","tests/verify-capability-extraction.ps1","tests/verify-change-contract.ps1","tests/verify-code-intel-provider-boundary.ps1","tests/verify-codex-entry-autoload.ps1","tests/verify-context-provider-boundary.ps1","tests/verify-context-provider-install-isolation.ps1","tests/verify-context-provider-vnext.ps1","tests/verify-declarative-distribution.ps1","tests/verify-exact-head-engineering-evidence.ps1","tests/verify-experimental-provider-docs.ps1","tests/verify-harness-entry.ps1","tests/verify-hashing-module.ps1","tests/verify-host-benchmark-otel.ps1","tests/verify-host-benchmark-qualification.ps1","tests/verify-host-benchmark-runner.ps1","tests/verify-install-isolation.ps1","tests/verify-kernel-tcb-inventory.ps1","tests/verify-lite-footprint.ps1","tests/verify-md-html-review-renderer.ps1","tests/verify-memory-health-report.ps1","tests/verify-memory-maintain.ps1","tests/verify-memory-provider-boundary.ps1","tests/verify-minimal-safe-change-policy.ps1","tests/verify-model-eval-runner.ps1","tests/verify-module-manifest-catalog.ps1","tests/verify-no-node-install-dependency.ps1","tests/verify-ordinary-ci-receipt.ps1","tests/verify-placeholder-rendering.ps1","tests/verify-preset-lifecycle-qualification.ps1","tests/verify-provider-routing-matrix.ps1","tests/verify-provider-usage-recording.ps1","tests/verify-release-full-receipt.ps1","tests/verify-release-isolation-qualification.ps1","tests/verify-release-producer-receipts.ps1","tests/verify-release-runner-boundary.ps1","tests/verify-release-validation.ps1","tests/verify-render-review-html.ps1","tests/verify-rollout-evidence.ps1","tests/verify-runtime-hooks.ps1","tests/verify-runtime-inbox.ps1","tests/verify-runtime-qualification-decoupling.ps1","tests/verify-task-artifact-drift-audit.ps1","tests/verify-team-preset.ps1","tests/verify-thin-adapters.ps1","tests/verify-thin-trust-kernel-contracts.ps1","tests/verify-triage-runtime-inbox.ps1","tests/verify-uninstall-isolation.ps1","tests/verify-update-managed-assets.ps1","tests/verify-v1-manifest-marker.ps1","tests/verify-v1-stop-loss-qualification.ps1","tests/verify-v1-sunset.ps1","tests/verify-v1-to-v2-migration.ps1","tests/verify-v2-approval.ps1","tests/verify-v2-baseline-benchmark.ps1","tests/verify-v2-ci-routing.ps1","tests/verify-v2-default-flip.ps1","tests/verify-v2-direct-no-artifacts.ps1","tests/verify-v2-entry-contract.ps1","tests/verify-v2-evidence.ps1","tests/verify-v2-governed-audit.ps1","tests/verify-v2-install-presets.ps1","tests/verify-v2-json-compat.ps1","tests/verify-v2-model-neutrality.ps1","tests/verify-v2-policy-contracts.ps1","tests/verify-v2-protocol-config.ps1","tests/verify-v2-readonly-zero-write.ps1","tests/verify-v2-requirement-gate.ps1","tests/verify-v2-runtime-memory-decoupling.ps1","tests/verify-v2-task-state.ps1"],"generator_contract_version":"module-manifest-generator/v1","manifest_root":"modules","modules":[{"capability_source_digest":"sha256:14496fdcbc8650714c41692d3e5db5bca9c6980a02ae34063c048f1b48a7c189","classification_owner":"benchmark","default_activation":false,"dependencies":{"kernel_api":"v1","modules":["codex-adapter","distribution","harness-maintenance","thin-trust-kernel"]},"description":"Model evaluation, host benchmark, telemetry collection, and baseline performance production.","exports":{"commands":["scripts/benchmark-harness.ps1","scripts/receive-otlp-http.ps1","scripts/run-host-benchmark.ps1","scripts/run-model-evals.ps1"],"hooks":[],"libraries":["scripts/lib/Harness.ModelEval.psm1"]},"kind":"capability","module_id":"benchmark","module_version":"1.0.0","ownership":{"owned_paths":["modules/benchmark/**","schemas/host-benchmark/**","schemas/model-eval-observation.schema.json","scripts/benchmark-harness.ps1","scripts/host-benchmark/**","scripts/lib/Harness.ModelEval.psm1","scripts/receive-otlp-http.ps1","scripts/run-host-benchmark.ps1","scripts/run-model-evals.ps1","tests/evals/**","tests/run-scenario-evals.ps1","tests/scenarios/**"],"watch_paths":["docs/testing/scenario-evals.md","scripts/lib/Harness.AtomicWrite.psm1","scripts/lib/Harness.Hashing.psm1","scripts/lib/Harness.Path.psm1","skills/codex/**"]},"package":{"code":["scripts/benchmark-harness.ps1","scripts/host-benchmark/**","scripts/lib/Harness.ModelEval.psm1","scripts/receive-otlp-http.ps1","scripts/run-host-benchmark.ps1","scripts/run-model-evals.ps1"],"install_assets":[],"schemas":["schemas/host-benchmark/**","schemas/model-eval-observation.schema.json"],"tests":["tests/evals/**","tests/run-scenario-evals.ps1","tests/scenarios/**"]},"requested_capabilities":["filesystem-read","filesystem-write","network","process-execution"],"schema_version":"harness-module/v1","validation":{"changed":[],"core_groups":{"entry-lifecycle":[],"evaluation-release":["tests/run-scenario-evals.ps1"],"governance-approval":[],"harness-contracts":[],"install-evidence":[]},"full":[],"owner_tests":["tests/run-scenario-evals.ps1"],"quick":[]}},{"default_activation":false,"dependencies":{"kernel_api":"v1","modules":["entry-kernel"]},"description":"Codex host configuration and command serialization adapter.","entrypoints":{"commands":["skills/codex/scripts/ask_codex.ps1","skills/codex/scripts/invoke_codex.ps1"],"hooks":[]},"kind":"adapter","module_id":"codex-adapter","ownership":{"owned_paths":["agent-configs/codex/**","modules/codex-adapter/**","skills/codex/**"],"watch_paths":[]},"requested_capabilities":["capability-read","filesystem-read","process-execution"],"schema_version":"harness-module/v0","validation":{"changed":["tests/verify-ask-codex.ps1","tests/verify-codex-entry-autoload.ps1"],"core_group":null,"full":["tests/verify-ask-codex.ps1","tests/verify-codex-entry-autoload.ps1"],"owner_tests":["tests/verify-ask-codex.ps1","tests/verify-codex-entry-autoload.ps1"],"quick":[]}},{"default_activation":true,"dependencies":{"kernel_api":"v1","modules":["thin-trust-kernel"]},"description":"Bootstrap, installation, update, uninstall, and isolated distribution verification.","entrypoints":{"commands":["harness.ps1","install.ps1","scripts/get-distribution-plan.ps1","scripts/update-managed-assets.ps1","uninstall.ps1"],"hooks":[]},"kind":"capability","module_id":"distribution","ownership":{"owned_paths":["harness.cmd","harness.ps1","install.ps1","modules/distribution/**","schemas/distribution-plan.schema.json","schemas/install-profile.schema.json","scripts/generate-skills-index.ps1","scripts/get-distribution-plan.ps1","scripts/install-transaction-common.ps1","scripts/lib/Harness.Distribution.psm1","scripts/run-isolated-install-smoke.ps1","scripts/update-managed-assets.ps1","tests/fixture-test-common.ps1","uninstall.ps1"],"watch_paths":["scripts/lib/Harness.AtomicWrite.psm1","scripts/lib/Harness.Hashing.psm1","scripts/lib/Harness.Path.psm1"]},"requested_capabilities":["filesystem-read","filesystem-write","process-execution"],"schema_version":"harness-module/v0","validation":{"changed":[],"core_group":"install-evidence","full":["tests/verify-declarative-distribution.ps1","tests/verify-preset-lifecycle-qualification.ps1","tests/verify-v2-evidence.ps1","tests/verify-v2-install-presets.ps1"],"owner_tests":["tests/verify-declarative-distribution.ps1","tests/verify-v2-install-presets.ps1","tests/verify-preset-l